{
  "$schema": "../experiment.schema.json",
  "schema_version": 1,
  "experiment_id": "E20260914081253343514",
  "owner": "iakupovaslan",
  "title": "E060 epoch sweep",
  "track": "neural",
  "status": "planned",
  "hypothesis": "Longer training (2-4 epochs instead of 1) of the swap-equivariant pair encoder improves validation log loss enough to make it a standalone candidate or ensemble component.",
  "parent_experiment_id": "E060",
  "changed_factor": "Number of training epochs only (2, 3, and up to 4), backbone/split/batch size/truncation/architecture unchanged from E060.",
  "seed": 20260903,
  "evaluation_role": "selection",
  "smoke_test": true,
  "model": {
    "name": "microsoft/deberta-v3-small",
    "revision": null
  },
  "training": {
    "notebook": "output/jupyter-notebook/E20260914081253343514__e060-epoch-sweep.ipynb",
    "max_length": 256,
    "special_tokens": 3,
    "prompt_weight": 1,
    "response_weight": 2,
    "batch_size": 16,
    "eval_batch_size": 32,
    "learning_rate": 2e-05,
    "head_learning_rate": 0.001,
    "warmup_ratio": 0.06,
    "weight_decay": 0.01,
    "max_grad_norm": 1.0,
    "epoch_checkpoints": [
      2,
      3,
      4
    ]
  },
  "tracking": {
    "backend": "clearml",
    "mode": "online"
  },
  "tags": [
    "neural",
    "swap-equivariant",
    "epoch-sweep",
    "sprint2"
  ],
  "notes": "Sprint 2 task: repeat E060 from a clean commit through the ExperimentRun pipeline, sweeping epochs 2/3/4 only."
}