{
  "$schema": "../experiment.schema.json",
  "schema_version": 1,
  "experiment_id": "E20260914010000000001",
  "owner": "Karim",
  "title": "E2 QLoRA multi-seed candidate - seed 17",
  "track": "ablation",
  "status": "planned",
  "hypothesis": "The frozen HPO-winning QLoRA configuration is reproducible across seeds and probability averaging improves fold-7 log loss.",
  "parent_experiment_id": "E20260909170000000000",
  "changed_factor": "Training seed only: 17 instead of the reference seed 42.",
  "seed": 17,
  "evaluation_role": "selection",
  "smoke_test": false,
  "model": {
    "name": "microsoft/deberta-v3-base",
    "revision": "8ccc9b6f36199bec6961081d44eb72fb3f7353f3"
  },
  "training": {
    "runner": "scripts/train_e2_qlora.py",
    "epochs": 3,
    "scheduler_horizon_epochs": 5,
    "effective_batch_size": 32,
    "max_length": 512,
    "optimizer": "AdamW",
    "weight_decay": 0.01,
    "warmup_ratio": 0.06,
    "max_grad_norm": 1.0,
    "qlora": {
      "r": 16,
      "alpha": 32,
      "dropout": 0.05,
      "learning_rate": 0.00028,
      "target_modules": ["query_proj", "value_proj"],
      "modules_to_save": ["pooler", "classifier"],
      "quantization": "nf4",
      "double_quantization": true
    },
    "augmentation": {
      "random_ab_swap_probability": 0.5,
      "validation_swap_averaging": true
    },
    "frozen_from": {
      "experiment_id": "E20260909170000000000",
      "trial_id": "high_lr_r16",
      "selected_epoch": 3,
      "fold7_log_loss": 1.0162713445692457
    }
  },
  "tracking": {
    "backend": "clearml",
    "mode": "online"
  },
  "tags": ["sprint-2", "e2", "qlora", "multiseed", "seed-17", "selection-only"],
  "notes": "The candidate, epoch count and scheduler horizon were frozen before the multi-seed runs. Fold 8, fold 9 and Kaggle are not read."
}
