{
  "$schema": "../experiment.schema.json",
  "schema_version": 1,
  "experiment_id": "E20260909125010457517",
  "owner": "avlaptev",
  "title": "B2 Word and character TF-IDF baseline",
  "track": "classical",
  "status": "planned",
  "hypothesis": "Combined word- and character-level TF-IDF captures lexical, stylistic, and formatting signals that reduce selection-fold log loss relative to the structural baseline.",
  "parent_experiment_id": "E002",
  "changed_factor": "Replace structural-only inputs with combined word- and character-level TF-IDF response features and prompt-response similarities.",
  "seed": 42,
  "evaluation_role": "selection",
  "smoke_test": true,
  "model": {
    "name": "word-char-tfidf-linear-logistic",
    "revision": null
  },
  "training": {
    "notebook": "output/jupyter-notebook/E20260909125010457517__b2-word-and-character-tf-idf.ipynb",
    "word_tfidf": {
      "ngram_range": [
        1,
        2
      ],
      "max_features": 75000,
      "min_df": 3,
      "max_df": 0.995
    },
    "character_tfidf": {
      "analyzer": "char_wb",
      "ngram_range": [
        3,
        5
      ],
      "max_features": 50000,
      "min_df": 5,
      "max_df": 0.995
    },
    "classifier": {
      "loss": "log_loss",
      "alpha_candidates": [
        0.001,
        0.0003,
        0.0001
      ],
      "max_iter": 30,
      "average": true
    },
    "smoke_train_rows": 3000,
    "smoke_validation_rows": 900
  },
  "tracking": {
    "backend": "clearml",
    "mode": "online"
  },
  "tags": [
    "self-service",
    "notebook"
  ],
  "notes": "Generated by the self-service experiment wizard."
}
