{
  "$schema": "../experiment.schema.json",
  "schema_version": 1,
  "experiment_id": "E20260905212645934620",
  "owner": "Karim",
  "title": "E2 - DeBERTa full vs LoRA vs QLoRA",
  "track": "neural",
  "status": "planned",
  "hypothesis": "Parameter-efficient fine-tuning should retain DeBERTa classification quality while reducing trainable parameters and peak GPU memory; QLoRA should reduce memory further with bounded log-loss degradation.",
  "parent_experiment_id": "E002",
  "changed_factor": "Fine-tuning method: full fine-tuning versus LoRA versus QLoRA on the same pinned DeBERTa backbone and frozen evaluation protocol.",
  "seed": 42,
  "evaluation_role": "selection",
  "smoke_test": false,
  "model": {
    "name": "microsoft/deberta-v3-base",
    "revision": "8ccc9b6f36199bec6961081d44eb72fb3f7353f3"
  },
  "training": {
    "notebook": "output/jupyter-notebook/E20260905212645934620__e2-deberta-full-vs-lora-vs.ipynb",
    "epochs": 3,
    "effective_batch_size": 32,
    "optimizer": "AdamW",
    "weight_decay": 0.01,
    "warmup_ratio": 0.06,
    "max_grad_norm": 1.0,
    "max_length": 512,
    "max_length_fallback": 384,
    "max_length_fallback_threshold_seconds_per_500_steps": 14400,
    "preprocessing": {
      "segments": [
        "prompt",
        "response_a",
        "response_b"
      ],
      "budget_weights": [
        1,
        2,
        2
      ],
      "truncation": "balanced_head_tail",
      "null_sentinel": "null_response",
      "turn_boundary": "<turn_boundary>",
      "model_identity_features": false
    },
    "augmentation": {
      "random_ab_swap_probability": 0.5,
      "validation_swap_averaging": true
    },
    "lora_screening": {
      "optimizer_steps": 500,
      "reference": {
        "r": 16,
        "alpha": 32,
        "dropout": 0.05,
        "learning_rate": 0.0001
      },
      "rank": {
        "r": 8
      },
      "dropout": {
        "dropout": 0.0
      },
      "learning_rate": {
        "learning_rate": 0.0002
      }
    },
    "arms": {
      "full_ft": {
        "learning_rate": 2e-05
      },
      "lora": {
        "target_modules": [
          "query_proj",
          "value_proj"
        ],
        "modules_to_save": [
          "pooler",
          "classifier"
        ]
      },
      "qlora": {
        "quantization": "nf4",
        "double_quantization": true,
        "requested_compute_dtype": "bfloat16",
        "t4_fallback_compute_dtype": "float16"
      }
    }
  },
  "tracking": {
    "backend": "clearml",
    "mode": "online"
  },
  "tags": [
    "self-service",
    "notebook",
    "sprint-1",
    "e2",
    "deberta-v3-base"
  ],
  "notes": "Generated by the self-service experiment wizard. Full FT, LoRA and QLoRA share the frozen split, seed, preprocessing and evaluation. T4 uses FP16 because it lacks native BF16; the actual dtype is recorded per run."
}
