{
  "$schema": "../experiment.schema.json",
  "schema_version": 1,
  "experiment_id": "E20260909084650499713",
  "owner": "kite121",
  "title": "B3 Frozen MPNet embeddings with CatBoost",
  "track": "neural",
  "status": "completed",
  "hypothesis": "Frozen all-mpnet-base-v2 embeddings with a CatBoost head improve log loss over structural baselines.",
  "parent_experiment_id": "E002",
  "changed_factor": "Frozen all-mpnet-base-v2 prompt-response embeddings with a CatBoost classifier",
  "seed": 42,
  "evaluation_role": "selection",
  "smoke_test": false,
  "model": {
    "name": "sentence-transformers/all-mpnet-base-v2",
    "revision": "e8c3b32edf5434bc2275fc9bab85f82640a19130"
  },
  "training": {
    "notebook": "output/jupyter-notebook/E20260909084650499713__b3-frozen-mpnet-embeddings-with-lr.ipynb",
    "classifiers": [
      "catboost"
    ],
    "catboost": {
      "task_type": "GPU",
      "hpo_configs": [
        {
          "iterations": 600,
          "depth": 6,
          "learning_rate": 0.05,
          "l2_leaf_reg": 10.0
        }
      ]
    }
  },
  "tracking": {
    "backend": "clearml",
    "mode": "online"
  },
  "tags": [
    "self-service",
    "notebook",
    "b3",
    "frozen-embeddings",
    "catboost",
    "kaggle"
  ],
  "notes": "Kaggle Code version 7 ran offline with all-mpnet-base-v2 and CatBoost. The public competition result is recorded separately in results/kaggle_submissions.csv; it is not a local selection-fold metric."
}
