{
  "$schema": "../experiment.schema.json",
  "schema_version": 1,
  "experiment_id": "E202609140001",
  "owner": "nikita",
  "title": "Sprint 2 sparse TF-IDF sweep",
  "track": "classical",
  "status": "planned",
  "hypothesis": "Word and character TF-IDF choices and regularization can improve the existing sparse preference baseline on the fixed selection fold.",
  "parent_experiment_id": "E010",
  "changed_factor": "Sequentially vary analyzer, n-gram range, vocabulary size, min_df, and alpha while keeping the frozen split and training protocol fixed.",
  "seed": 20260903,
  "evaluation_role": "selection",
  "smoke_test": true,
  "model": {
    "name": "sparse-tfidf-sgd",
    "revision": "sprint2-sweep-v1"
  },
  "training": {
    "script": "scripts/sweep_sparse_sprint2.py",
    "baseline": "E010",
    "training_folds": [
      0,
      1,
      2,
      3,
      4,
      5,
      6
    ],
    "validation_fold": 7,
    "a_b_swap_augmentation": true,
    "a_b_swap_inference_average": true,
    "stages": [
      "analyzer_and_ngram",
      "max_features",
      "min_df",
      "alpha"
    ]
  },
  "tracking": {
    "backend": "clearml",
    "mode": "disabled"
  },
  "tags": [
    "sprint2",
    "classical",
    "sparse-tfidf",
    "word-char-ngrams",
    "cpu"
  ],
  "notes": "Selection-only sweep. Fold 8 is reserved for calibration after the base sparse model is frozen; fold 9 remains untouched."
}
